area_code,name_en,name_cy,,,,
W11000028,Aneurin Bevan University Health Board,Bwrdd Iechyd Prifysgol Aneurin Bevan,,,,
W11000029,Cardiff and Vale University Health Board,Bwrdd Iechyd Prifysgol Caerdydd a'r Fro,,,,
W11000030,Cwm Taf Morgannwg University Health Board,Bwrdd Iechyd Prifysgol Cwm Taf Morgannwg,,,,
W11000031,Swansea Bay University Health Board,Bwrdd Iechyd Prifysgol Bae Abertawe,,,,
W11000025,Hywel Dda University Health Board,Bwrdd Iechyd Prifysgol Hywel Dda,,,,
W11000024,Powys Teaching Health Board,Bwrdd Iechyd Addysgu Powys,,,,
W11000023,Betsi Cadwaladr University Health Board,Bwrdd Iechyd Prifysgol Betsi Cadwaladr,,,,
